{
  "$schema": "https://json-schema.org/draft/2020-12/schema",
  "$id": "https://woodshop.dev/schemas/wood_movement_check.output.json",
  "title": "WoodMovementCheckOutput",
  "type": "object",
  "additionalProperties": false,
  "properties": {
    "project_id": { "$ref": "./common.schema.json#/$defs/projectId" },
    "ambient": { "$ref": "./common.schema.json#/$defs/ambient" },
    "per_part": {
      "type": "array",
      "items": {
        "type": "object",
        "additionalProperties": false,
        "properties": {
          "part_id": { "type": "string" },
          "species": { "type": "string" },
          "delta_length_mm": { "type": "number" },
          "delta_width_mm": { "type": "number" },
          "delta_thickness_mm": { "type": "number" },
          "warning": { "type": ["string", "null"] }
        },
        "required": [
          "part_id",
          "species",
          "delta_length_mm",
          "delta_width_mm",
          "delta_thickness_mm"
        ]
      }
    },
    "warnings": {
      "type": "array",
      "items": { "$ref": "./common.schema.json#/$defs/warning" }
    },
    "seed": { "$ref": "./common.schema.json#/$defs/seedOutput" },
    "engine_versions": { "$ref": "./common.schema.json#/$defs/engineVersions" },
    "revision_id": { "$ref": "./common.schema.json#/$defs/revisionId" },
    "inputs_hash": { "$ref": "./common.schema.json#/$defs/inputsHash" }
  },
  "required": [
    "project_id",
    "ambient",
    "per_part",
    "warnings",
    "seed",
    "engine_versions",
    "revision_id",
    "inputs_hash"
  ]
}
