{
  "project_id": "proj_demo",
  "ambient": {
    "relative_humidity": 55,
    "temperature_c": 21
  },
  "per_part": [
    {
      "part_id": "proj_demo::panel_top",
      "species": "birch",
      "delta_length_mm": 0.45,
      "delta_width_mm": 0.92,
      "delta_thickness_mm": 0.12,
      "warning": null
    }
  ],
  "warnings": [
    {
      "part_id": null,
      "severity": "info",
      "message": "Movement within acceptable tolerance."
    }
  ],
  "seed": 5,
  "engine_versions": {
    "occt": "0.0.0",
    "nest": "0.0.0",
    "cam": "0.0.0",
    "wood": "0.0.0",
    "schemas": "0.0.0"
  },
  "revision_id": "rev_local",
  "inputs_hash": "4a44dc15364204a80fe80e9039455cc1608281820fe1a5e3c6c8b0d8dd1c1e40"
}
