{
  "ambient": {
    "relative_humidity": 55,
    "temperature_c": 21
  },
  "engine_versions": {
    "cam": "0.0.0",
    "nest": "0.0.0",
    "occt": "0.0.0",
    "schemas": "0.0.0",
    "wood": "0.0.0"
  },
  "inputs_hash": "c0d3717ac663c1f2b12ca9a1a3f583269c517e231de61ff96d1f4a66ed648af4",
  "per_part": [
    {
      "delta_length_mm": 0.12,
      "delta_thickness_mm": 0.008,
      "delta_width_mm": 1.562,
      "part_id": "proj_842ca66e834c::back_panel",
      "species": "birch",
      "warning": "Movement exceeds 1mm on at least one axis."
    },
    {
      "delta_length_mm": 0.12,
      "delta_thickness_mm": 0.024,
      "delta_width_mm": 0.82,
      "part_id": "proj_842ca66e834c::panel_bottom",
      "species": "birch",
      "warning": null
    },
    {
      "delta_length_mm": 0.076,
      "delta_thickness_mm": 0.024,
      "delta_width_mm": 0.781,
      "part_id": "proj_842ca66e834c::panel_side_a",
      "species": "birch",
      "warning": null
    },
    {
      "delta_length_mm": 0.076,
      "delta_thickness_mm": 0.024,
      "delta_width_mm": 0.781,
      "part_id": "proj_842ca66e834c::panel_side_b",
      "species": "birch",
      "warning": null
    },
    {
      "delta_length_mm": 0.12,
      "delta_thickness_mm": 0.024,
      "delta_width_mm": 0.82,
      "part_id": "proj_842ca66e834c::panel_top",
      "species": "birch",
      "warning": null
    },
    {
      "delta_length_mm": 0.115,
      "delta_thickness_mm": 0.024,
      "delta_width_mm": 0.779,
      "part_id": "proj_842ca66e834c::shelf_mid",
      "species": "birch",
      "warning": null
    }
  ],
  "project_id": "proj_842ca66e834c",
  "revision_id": "d1fe083eb15cbc8d24463137ac0e7f5cd2d5b4ec",
  "seed": 0,
  "warnings": [
    {
      "message": "Movement exceeds 1mm on at least one axis.",
      "part_id": "proj_842ca66e834c::back_panel",
      "severity": "warning"
    }
  ]
}
