{
  "ambient": {
    "relative_humidity": 55,
    "temperature_c": 21
  },
  "engine_versions": {
    "cam": "0.0.0",
    "nest": "0.0.0",
    "occt": "0.0.0",
    "schemas": "0.0.0",
    "wood": "0.0.0"
  },
  "inputs_hash": "b411b28667d0d389816f9ac1b0fea47f16ddf657466cff8957bcbc5ecb87db9a",
  "per_part": [
    {
      "delta_length_mm": 0.12,
      "delta_thickness_mm": 0.008,
      "delta_width_mm": 1.562,
      "part_id": "proj_e304c8924cb5::back_panel",
      "species": "birch",
      "warning": "Movement exceeds 1mm on at least one axis."
    },
    {
      "delta_length_mm": 0.12,
      "delta_thickness_mm": 0.027,
      "delta_width_mm": 0.76,
      "part_id": "proj_e304c8924cb5::panel_bottom",
      "species": "oak",
      "warning": null
    },
    {
      "delta_length_mm": 0.076,
      "delta_thickness_mm": 0.024,
      "delta_width_mm": 0.781,
      "part_id": "proj_e304c8924cb5::panel_side_a",
      "species": "birch",
      "warning": null
    },
    {
      "delta_length_mm": 0.076,
      "delta_thickness_mm": 0.027,
      "delta_width_mm": 0.724,
      "part_id": "proj_e304c8924cb5::panel_side_b",
      "species": "oak",
      "warning": null
    },
    {
      "delta_length_mm": 0.12,
      "delta_thickness_mm": 0.024,
      "delta_width_mm": 0.82,
      "part_id": "proj_e304c8924cb5::panel_top",
      "species": "birch",
      "warning": null
    },
    {
      "delta_length_mm": 0.115,
      "delta_thickness_mm": 0.027,
      "delta_width_mm": 0.722,
      "part_id": "proj_e304c8924cb5::shelf_mid",
      "species": "oak",
      "warning": null
    }
  ],
  "project_id": "proj_e304c8924cb5",
  "revision_id": "97fd46038317a780454e2e7dcb5ce0255739c36b",
  "seed": 9,
  "warnings": [
    {
      "message": "Movement exceeds 1mm on at least one axis.",
      "part_id": "proj_e304c8924cb5::back_panel",
      "severity": "warning"
    }
  ]
}
